{"attempt":1,"base_prompt_hash":"f7eb360e1cb0c32f240e9be47e3aee94348d0af24b0736aa25893230e68071cb","input_hash":"b16b28815166abbcef183a39182726d089fc2947e527b1e3540e93f083262b05","job_key":"EXP3V2-F8-002|agent_3|A|3","prompt_hash":"f7eb360e1cb0c32f240e9be47e3aee94348d0af24b0736aa25893230e68071cb","record_type":"provider_response","request_parameters":{"max_output_tokens":512,"previous_response_id_used":false,"reasoning_effort":"medium","seed_sent":false,"store":false,"temperature_sent":false},"requested_model":"gpt-5.6-terra","response":{"api_family":"Responses API","endpoint":"/v1/responses","input_tokens":1659,"output_tokens":264,"raw_output":"{\"predicted_label\":null,\"abstain\":true,\"used_insight_ids\":[],\"reasoning_summary\":\"Il caso è chiaramente non normale, ma l'unica classe anomala esemplificata riguarda anomalie concentrate su XMEAS-18. Qui le anomalie coinvolgono XMEAS-1, XMEAS-20 e XMEAS-10, senza un esempio che consenta di associare in modo affidabile uno degli altri label.\"}","request_id":"req_fdbec98baaa944b7a053edc8e4e91604","requested_model":"gpt-5.6-terra","response_id":"resp_027d58b925727bcd016a9ad3f5a33087d2bad12cbff60a2fa7","response_raw":{"background":false,"billing":{"payer":"developer"},"completed_at":1788531707.0,"conversation":null,"created_at":1788531701.0,"error":null,"frequency_penalty":0.0,"id":"resp_027d58b925727bcd016a9ad3f5a33087d2bad12cbff60a2fa7","incomplete_details":null,"instructions":null,"max_output_tokens":512,"max_tool_calls":null,"metadata":{},"model":"gpt-5.6-terra","moderation":null,"object":"response","output":[{"content":[],"encrypted_content":"gAAAAABqmtP7vkae_oIYCJWFQY9bTSVYlS8NZT_FFbcBxJtGVb5HBc5yDShMQ5cR3ePsALk8nmSC1R3Y4m5W2IzCHLgazZW6HZDZT6Tifmvu5VbdT8PpmkO09VIkrO3-nnT0zUHf6BmQpExkYBUcF8_NblWlUEGnmzpNCMHu8noPEKhZbwM1_IzBNhw09dVyl0Z3qrXMg6paPc236Eq0GVcDqC8X58LfQ1UkjddO9vKOjWAtj2ux1afaG6ex69rz9nqLQ3FLw_hROz2024nGOid0PJL5BWtQs2FgHhzcCRdVivHQ8sBr-FnYnYpIP5ZNgfr0d9QLZoLM4VHk9UOb0I_zHQzQyurjKfNpl8kXUj3OY6IgLovXZbRKCf7tV19_6xdAgqA4TYBMB2TFhy44oPHeBltA9rnzHBY_YXLMprklg2LW9SAVrHxgjpwpiPwRC-ApuGFRlj1Fia2cMETZwh6ECAHQSuXWB4Hb7110Ac-4W8lw2zq-ubhJ4ffq34igTx4LoCqQ83D_HKhNMpvqfIWL23iUM5CuPpWyDlO5c6eSktRD-mkEMYChb6LdyUkDX9cWIhHyNmv7JI5-NzTXUpCKOXsCjgrz5q52YPTvEfnix2bQC4Kaqm3S30Vb4Mn5ok_S83oTv6fubXIi0J5p_MADCv0YWMimNpgkpOpy4n64znGPClhlK517FfCl92gDZM4kYHins_sGvJWy_l1ugXHm_G70n63RVxqHCzswACg1j4N72Ft280nj3wsEx-8udI5NMhclcTs2Psgsr79UVYiytf9IVednnomqcw87E48Fvzdrh_aB6R03cW9rnnc4AhDuCRfTcD5Jocg965ZIAu_-82gawGAeY_mp-iX6OHHGCSVud9dyDr8UhdkoN17ly_FBBFm9ukIeh6SoSVoJRoqh_KEBOGJEQDpWEZSpC35_6v1d7UKD7h4e16OaN-UCsJUqOquRhgNBz__LGdTrvXF589DG_cL0QtoJ25XuudahRsUnBryzrGstN328iLJjxveuAm2D8Xkunc8WxaHMRISo_4i7UGqHk9aEqsqP69vFe5SndFXjXX02R8FBJpygf3ti5-iwLdiyA76EalAqqMFYc-o0-No7GDbuUFwBwOqmww7XFuaS-ixkjK9xxOWVqAZSIh9eVpNh3ZiPccP-CWN_PFpw3oKWb661956b7TOgTSufU7JclUfwTBsXA2dVTA2NXHj_fbiJZNVuTmwIXlN-43hpPQUSoBP2CVGY2W1UMF2MNekHbg6xSAoJgTJ9rT0-CembFPCDucH7R8OEt5373VTHLxmJfR-3aEFNnJLzDU4azmjdv82v9X7ww5bWqtzqYqdRFLXc5p88xci1DHU8u6Onay2vjbuv2pJRMnBZ9OBYJm2GGJ2jrNJLuFvK_af97WN_FMz_bWBTsI7TueDGrV0dxrvfO_dz1R-dlxJzlIswZum_xUXXsFcI158o6r2qeE5eIBEWEg-xmRjW-pQAsmHQQQDtAbQpA1AMeOeO8E8rCC2GwTxnhntqIY3rAOSMtylS1xbp2AYrAPWXJ0y5Q-0a3DBHj6tRtWQFtBgzqTs3l7iNtOn0umIAVeAf2V9o5lUwahvJhDD3Ttfl8vfyDtOtDeRQfaeatU8L2bo3guXqOE__6w4BSYRHSHKdKAAwvF41hRuA6TPiET_BdGlxhNyz7DOmCTmarL8tELsIEyOuCHaYN8b22CtKSn9X8-euvXhn4xLxTbFceqm3J0jd6GzV6VHzXrR6KclRbgrPfsQPMLNh7lppRipZ3OF0nsiJJLE9OZOqB1b9aOcqvy1-ODObnhgwDvVhsKKVpy6PLFsWZXRkwBABX0Mz0F_xq_TzRDaOFue3IzaKBHe8JICIvuBd-S0OqJwEEOQ3J-z-2vQ9hXGlfYwUnUM8o8ZZ_i73LnmgOn1M9MW2PG_8-CQ5AJatfQjToySfWmLi3Q7sNGeALUXpsUQv4YgtzXKM9kzL71QnS3bg0fvUmOM5Lg_4gqV6XcHDZxLkKxyin4xm5SA2uBs2YGB6pyj-gT3KRwsMHvmSBXsMkZtfAX4T8q1HsX_uyEFoz3ZW7f2g75COu7fgY3x_pAGiYHdM-YBs4FX87K__DNYB","id":"rs_027d58b925727bcd016a9ad3f6a18087d2b760d5c205473370","status":null,"summary":[],"type":"reasoning"},{"content":[{"annotations":[],"logprobs":[],"text":"{\"predicted_label\":null,\"abstain\":true,\"used_insight_ids\":[],\"reasoning_summary\":\"Il caso è chiaramente non normale, ma l'unica classe anomala esemplificata riguarda anomalie concentrate su XMEAS-18. Qui le anomalie coinvolgono XMEAS-1, XMEAS-20 e XMEAS-10, senza un esempio che consenta di associare in modo affidabile uno degli altri label.\"}","type":"output_text"}],"id":"msg_027d58b925727bcd016a9ad3f95c6087d2be58dda8107f48a9","phase":"final_answer","role":"assistant","status":"completed","type":"message"}],"parallel_tool_calls":true,"presence_penalty":0.0,"previous_response_id":null,"prompt":null,"prompt_cache_key":null,"prompt_cache_options":null,"prompt_cache_retention":"24h","reasoning":{"context":"all_turns","effort":"medium","generate_summary":null,"mode":"standard","summary":null},"safety_identifier":null,"service_tier":"default","status":"completed","store":false,"temperature":1.0,"text":{"format":{"description":null,"name":"phase_b_diagnostic_output","schema_":{"additionalProperties":false,"properties":{"abstain":{"type":"boolean"},"predicted_label":{"type":["string","null"]},"reasoning_summary":{"minLength":1,"type":"string"},"used_insight_ids":{"items":{"type":"string"},"type":"array"}},"required":["predicted_label","abstain","used_insight_ids","reasoning_summary"],"title":"Phase B diagnostic output (OpenAI Structured Outputs)","type":"object"},"strict":true,"type":"json_schema"},"verbosity":"medium"},"tool_choice":"auto","tool_usage":{"image_gen":{"input_tokens":0,"input_tokens_details":{"image_tokens":0,"text_tokens":0},"output_tokens":0,"output_tokens_details":{"image_tokens":0,"text_tokens":0},"total_tokens":0},"web_search":{"num_requests":0}},"tools":[],"top_logprobs":0,"top_p":0.98,"truncation":"disabled","usage":{"compute_units":null,"input_tokens":1659,"input_tokens_details":{"cache_write_tokens":0,"cached_tokens":1656},"output_tokens":264,"output_tokens_details":{"reasoning_tokens":154},"total_tokens":1923},"user":null},"returned_model":"gpt-5.6-terra","sdk_version":"3.6.0","total_tokens":1923,"usage_raw":{"compute_units":null,"input_tokens":1659,"input_tokens_details":{"cache_write_tokens":0,"cached_tokens":1656},"output_tokens":264,"output_tokens_details":{"reasoning_tokens":154},"total_tokens":1923}},"sequence_index":493,"timestamp":"2026-09-04T14:21:47.568719+00:00"}
