{"attempt":1,"base_prompt_hash":"c6cee021c367c4e9c07381422ac8a482683430f6999d2192e0f5ad61a1710503","input_hash":"e935ef02954bd2a5a50e9625c89190cdfda9d47b9ccbe00c4362d42a6b56d2df","job_key":"EXP3V2-F10-002|agent_1|B|3","prompt_hash":"c6cee021c367c4e9c07381422ac8a482683430f6999d2192e0f5ad61a1710503","record_type":"provider_response","request_parameters":{"max_output_tokens":512,"previous_response_id_used":false,"reasoning_effort":"medium","seed_sent":false,"store":false,"temperature_sent":false},"requested_model":"gpt-5.6-terra","response":{"api_family":"Responses API","endpoint":"/v1/responses","input_tokens":2309,"output_tokens":120,"raw_output":"{\"predicted_label\":\"CLS-R463B\",\"abstain\":false,\"used_insight_ids\":[\"INS-005\",\"INS-006\"],\"reasoning_summary\":\"Il caso coincide con il pattern CLS-R463B: XMEAS-18 ha residual sopra soglia in 8/8 finestre, inclusi inizio e fine, con superamenti diff e residual+diff molto frequenti. Anche spostamento e pendenza di XMEAS-18 sono sopra soglia in quasi tutte o tutte le finestre.\"}","request_id":"req_2aa79cb46bd742be90671d9b9b65423a","requested_model":"gpt-5.6-terra","response_id":"resp_05d2381fa66ddcb5016a9ad75e6b0c87d290f3f53ff504f621","response_raw":{"background":false,"billing":{"payer":"developer"},"completed_at":1788532576.0,"conversation":null,"created_at":1788532574.0,"error":null,"frequency_penalty":0.0,"id":"resp_05d2381fa66ddcb5016a9ad75e6b0c87d290f3f53ff504f621","incomplete_details":null,"instructions":null,"max_output_tokens":512,"max_tool_calls":null,"metadata":{},"model":"gpt-5.6-terra","moderation":null,"object":"response","output":[{"content":[{"annotations":[],"logprobs":[],"text":"{\"predicted_label\":\"CLS-R463B\",\"abstain\":false,\"used_insight_ids\":[\"INS-005\",\"INS-006\"],\"reasoning_summary\":\"Il caso coincide con il pattern CLS-R463B: XMEAS-18 ha residual sopra soglia in 8/8 finestre, inclusi inizio e fine, con superamenti diff e residual+diff molto frequenti. Anche spostamento e pendenza di XMEAS-18 sono sopra soglia in quasi tutte o tutte le finestre.\"}","type":"output_text"}],"id":"msg_05d2381fa66ddcb5016a9ad75f27d487d2aa29618faad21543","phase":"final_answer","role":"assistant","status":"completed","type":"message"}],"parallel_tool_calls":true,"presence_penalty":0.0,"previous_response_id":null,"prompt":null,"prompt_cache_key":null,"prompt_cache_options":null,"prompt_cache_retention":"24h","reasoning":{"context":"all_turns","effort":"medium","generate_summary":null,"mode":"standard","summary":null},"safety_identifier":null,"service_tier":"default","status":"completed","store":false,"temperature":1.0,"text":{"format":{"description":null,"name":"phase_b_diagnostic_output","schema_":{"additionalProperties":false,"properties":{"abstain":{"type":"boolean"},"predicted_label":{"type":["string","null"]},"reasoning_summary":{"minLength":1,"type":"string"},"used_insight_ids":{"items":{"type":"string"},"type":"array"}},"required":["predicted_label","abstain","used_insight_ids","reasoning_summary"],"title":"Phase B diagnostic output (OpenAI Structured Outputs)","type":"object"},"strict":true,"type":"json_schema"},"verbosity":"medium"},"tool_choice":"auto","tool_usage":{"image_gen":{"input_tokens":0,"input_tokens_details":{"image_tokens":0,"text_tokens":0},"output_tokens":0,"output_tokens_details":{"image_tokens":0,"text_tokens":0},"total_tokens":0},"web_search":{"num_requests":0}},"tools":[],"top_logprobs":0,"top_p":0.98,"truncation":"disabled","usage":{"compute_units":null,"input_tokens":2309,"input_tokens_details":{"cache_write_tokens":0,"cached_tokens":2306},"output_tokens":120,"output_tokens_details":{"reasoning_tokens":0},"total_tokens":2429},"user":null},"returned_model":"gpt-5.6-terra","sdk_version":"3.6.0","total_tokens":2429,"usage_raw":{"compute_units":null,"input_tokens":2309,"input_tokens_details":{"cache_write_tokens":0,"cached_tokens":2306},"output_tokens":120,"output_tokens_details":{"reasoning_tokens":0},"total_tokens":2429}},"sequence_index":692,"timestamp":"2026-09-04T14:36:17.076098+00:00"}
