{"attempt":1,"base_prompt_hash":"ef931eb5a25bc50aabefc9bf8be79be929a2f0ecfee2a891c1f854cd7f500f7d","input_hash":"6b6c61257aed90fb1050c06d9d596dc127e4a11eeae0b12c9956fc7e377e2e3d","job_key":"EXP3V2-F10-003|agent_3|E|3","prompt_hash":"ef931eb5a25bc50aabefc9bf8be79be929a2f0ecfee2a891c1f854cd7f500f7d","record_type":"provider_response","request_parameters":{"max_output_tokens":512,"previous_response_id_used":false,"reasoning_effort":"medium","seed_sent":false,"store":false,"temperature_sent":false},"requested_model":"gpt-5.6-terra","response":{"api_family":"Responses API","endpoint":"/v1/responses","input_tokens":2340,"output_tokens":141,"raw_output":"{\"predicted_label\":\"CLS-R463B\",\"abstain\":false,\"used_insight_ids\":[],\"reasoning_summary\":\"Il profilo coincide strettamente con gli esempi CLS-R463B: anomalie persistenti su XMEAS-18 in spostamento, pendenza, residuo e variazioni campione-campione, con massima dispersione sulla stessa variabile.\"}","request_id":"req_776a5f7b538949e19597d2f5dd92d32e","requested_model":"gpt-5.6-terra","response_id":"resp_031c18f646191170016a9ad7fc6d9887d282e24b6d30db1412","response_raw":{"background":false,"billing":{"payer":"developer"},"completed_at":1788532734.0,"conversation":null,"created_at":1788532732.0,"error":null,"frequency_penalty":0.0,"id":"resp_031c18f646191170016a9ad7fc6d9887d282e24b6d30db1412","incomplete_details":null,"instructions":null,"max_output_tokens":512,"max_tool_calls":null,"metadata":{},"model":"gpt-5.6-terra","moderation":null,"object":"response","output":[{"content":[],"encrypted_content":"gAAAAABqmtf-N1eeYfcOhzVbXiqKUQjJ7gussO_Qi9_Ht6LuldGeR9zxlGf3YExNOZ7I8ftLY6Zv1aZ-bFHDmFJ_kY1fd5WOGgbUboDCY1vpFC9S2NlQa4wObUECTGdLOXQdXmUIt8hbLtEPXgH9Z-Vgv_8TgA0I06pQV3IDDxFTs4Qc7VCjHyGXs2sA_86TIfO_FQqUUHGqgaLeI4D2f580reAH0HBXwCKvWvWH5cIUq3LtErbtG1Z-mseW7RcdGCdSyl2b-lmPNyeLZU6BAlRoUZZnpu6jm_PEy5T8H5d3bEAnBKUhpqzjlpwr5QxvkpI0Ud5uMNUkLFoHEqe6PrsQy-2zGbzc5DY-2OfacvEJeDxsgAfSC3esp_bxBHcC0p4NCkx1cxVq0pwdfh6P7IG7GTd8cdt_u7PDgSrl1f9UjEt_67G4-27Z9Nb5UX8GNP67R0Crv-B_G5j1fR38sVh8RrACe_4S-7hi9NPczzYpPzt49YOzmcgq0ZkJtWCA97lwaJ1OoO3zQBRpIpjgu4reNzK1ajzSSCoT4aRxzobSvZM8U9X3hON4ix8WTUJyPBpjnA1Rdnejq69vy4DOqs-8q2shngcpfiv8cenNPaUwCTgpvw8oR3p_-ZurzlqeA1FsZmkao2zkuzDVIjjaE6IaMPErS3PIfQ8M69AaVGZFI7_IsKG8Cgp7_mmwcw8JcTcgc_XcFGWriGuVmdc6h0XKaev2xWO9ZNBcbDPa11WymP38rGRZEp5XdIirgfEooC6k8AUL51ZIPrqVV0wsCq-s5-lwX0J72Zp9Alvj0_dbItONiK02xQN-7OyiciEIXeEEpgxEbpOojDaMXasyw47LfvxKQ2gKsh_Y8UimaZp5_dnW_zi6zri_LZK7OEg18pYpzCJPaQXg40DPZTh-GjgrOWeSB-UoGDfU28uK1w3GZf8UbvhgIN0YUuqsTp95AsAg3HsRItajvSt1uvCEmEfTTrAMroM7e0OgCJy4Cs5fLhFg84WSwnaBTf7oyjun_z9Gz_iBgGVYw558a9AFoNQjIw9OiQDFTthJGPrLf3q4gVmrhZi9McxK6XwD4j7yc0yG5OAqxxqxt5vv2dkQwnaYH8_t_8ooB8S9qLQ2_HgmoXAsZHeR5LCamiHBdSjsNImTbISkbgEg6VJDnQoMuDs_i2ZhcZLkLVy4oS4_seQsrYV5M7IkcElfu02H-f6-HtluHXWq6lQjPz7ljumTKtT7wRMfocsSRSA1_Hgcw7TUVxoTRn9b1DR7DIjUlm_CSSANbC1bP1TwM8IIxhGdRs1tb_j2Xqrk9mBH5hcax42ZHnI2lQ91pTnMIu1YrWMC3uJuTNSfVZhOu2S0UJfOWVSydf0l0iLymC45k08ducf_hjxeOR7Z7-mooG8CUP_N5mI8XKjlYMPcW1l0xxnKlNURfBk1nF2oD8yGq5SjlzjWV2mZTT1TgE0=","id":"rs_031c18f646191170016a9ad7fcf06487d29ffa520fe047e3f6","status":null,"summary":[],"type":"reasoning"},{"content":[{"annotations":[],"logprobs":[],"text":"{\"predicted_label\":\"CLS-R463B\",\"abstain\":false,\"used_insight_ids\":[],\"reasoning_summary\":\"Il profilo coincide strettamente con gli esempi CLS-R463B: anomalie persistenti su XMEAS-18 in spostamento, pendenza, residuo e variazioni campione-campione, con massima dispersione sulla stessa variabile.\"}","type":"output_text"}],"id":"msg_031c18f646191170016a9ad7fde53887d280fd217a4afd8bae","phase":"final_answer","role":"assistant","status":"completed","type":"message"}],"parallel_tool_calls":true,"presence_penalty":0.0,"previous_response_id":null,"prompt":null,"prompt_cache_key":null,"prompt_cache_options":null,"prompt_cache_retention":"24h","reasoning":{"context":"all_turns","effort":"medium","generate_summary":null,"mode":"standard","summary":null},"safety_identifier":null,"service_tier":"default","status":"completed","store":false,"temperature":1.0,"text":{"format":{"description":null,"name":"phase_b_diagnostic_output","schema_":{"additionalProperties":false,"properties":{"abstain":{"type":"boolean"},"predicted_label":{"type":["string","null"]},"reasoning_summary":{"minLength":1,"type":"string"},"used_insight_ids":{"items":{"type":"string"},"type":"array"}},"required":["predicted_label","abstain","used_insight_ids","reasoning_summary"],"title":"Phase B diagnostic output (OpenAI Structured Outputs)","type":"object"},"strict":true,"type":"json_schema"},"verbosity":"medium"},"tool_choice":"auto","tool_usage":{"image_gen":{"input_tokens":0,"input_tokens_details":{"image_tokens":0,"text_tokens":0},"output_tokens":0,"output_tokens_details":{"image_tokens":0,"text_tokens":0},"total_tokens":0},"web_search":{"num_requests":0}},"tools":[],"top_logprobs":0,"top_p":0.98,"truncation":"disabled","usage":{"compute_units":null,"input_tokens":2340,"input_tokens_details":{"cache_write_tokens":0,"cached_tokens":2337},"output_tokens":141,"output_tokens_details":{"reasoning_tokens":46},"total_tokens":2481},"user":null},"returned_model":"gpt-5.6-terra","sdk_version":"3.6.0","total_tokens":2481,"usage_raw":{"compute_units":null,"input_tokens":2340,"input_tokens_details":{"cache_write_tokens":0,"cached_tokens":2337},"output_tokens":141,"output_tokens_details":{"reasoning_tokens":46},"total_tokens":2481}},"sequence_index":744,"timestamp":"2026-09-04T14:38:55.038859+00:00"}
