{"attempt":1,"base_prompt_hash":"8601874c96ec93b5e23c8aa2a0c4c8e2e2344d517b224dd2fafacdab049094ab","input_hash":"c9dec358709ede30706446b670d7b7302bccbab3e36177d7f3dcbdeda33e0e8e","job_key":"EXP3V2-F8-001|agent_2|B|1","prompt_hash":"8601874c96ec93b5e23c8aa2a0c4c8e2e2344d517b224dd2fafacdab049094ab","record_type":"provider_response","request_parameters":{"max_output_tokens":512,"previous_response_id_used":false,"reasoning_effort":"medium","seed_sent":false,"store":false,"temperature_sent":false},"requested_model":"gpt-5.6-terra","response":{"api_family":"Responses API","endpoint":"/v1/responses","input_tokens":2338,"output_tokens":294,"raw_output":"{\"predicted_label\":\"CLS-OJNSG\",\"abstain\":false,\"used_insight_ids\":[],\"reasoning_summary\":\"Il profilo combina dispersione massima su XMEAS-1, superamenti persistenti di residual su XMEAS-20 e di diff con co-occorrenza residual/diff su XMEAS-10. Questo è più coerente con gli esempi CLS-OJNSG rispetto alle firme centrate su XMEAS-1 positivo persistente, XMEAS-18 o XMEAS-7.\"}","request_id":"req_94e3cbd396fa41029a44c6e6ddd3938f","requested_model":"gpt-5.6-terra","response_id":"resp_0325baf3a8da6f37016a9ad2fcf15c87d288ea55dd7ed883e7","response_raw":{"background":false,"billing":{"payer":"developer"},"completed_at":1788531459.0,"conversation":null,"created_at":1788531452.0,"error":null,"frequency_penalty":0.0,"id":"resp_0325baf3a8da6f37016a9ad2fcf15c87d288ea55dd7ed883e7","incomplete_details":null,"instructions":null,"max_output_tokens":512,"max_tool_calls":null,"metadata":{},"model":"gpt-5.6-terra","moderation":null,"object":"response","output":[{"content":[],"encrypted_content":"gAAAAABqmtMDYV0cwWdcKdaUT6ImxPHJEiHqJQ7Zukzb4nNtCrTlctysNaHRUn0W1sF5hbBhjCT1qFHLw7lHgRznsyL4q3-wW4TU8OVT8ks9Tyvd1Hsef7WmqNOLLDOAYld_ImYUE3g6ugwj5to2dutTgaP8KkRuyXXr9mpXjWYPWbitcr3IxQL7tL8EyzzbVN1h4W75K0pfLjTDs8ZEWHARxtDOzaXy6kJm5YiOQ02VsSEcCq1YFwwFmiJgqPcdbnH3PrV1D4ZZ-6GMcuFPtWnLg4n8tu8U-zlHF6iplaw6ZvOyxvwWr8mUQyk_T43An2nUTYK31XkZLcP-uoKpzAJ8mR_POWjRP0gezN41VbDWnRMDxtjwq40OzbcCbRi4dGDYG3IkeToPk4Ps3mK_vfpFMkmI0dboWjKiIvZEzhlROLRGGZppdRa5OK3cOzn3lB-qfttdeZJ7wXanJOgZYN0M9CGCA6yK_fiPvqszPqlwsa90c82WNJ_7UHcr1_abaH7P85Q1B9jJ78LP-fk0UPSoWp9ji_C4zw2gWwMZWErHtcVifInEyXYjDAtf94TGYsK_IzPlnAx9ChRYlhT9m8jCmHgdWTt0OTMvxTNwHTO2fFTmxxsKrxiYISgw4ZhDnYLYUJFMjrhw79U7K2lFS-3xWxKNIABkeAgXilCb11nKLtLWZOXaQK_Ww-dqEJ6dxPPB8Re6coQlcIuo2ACmMO14cM8z9D7TmP8TgKPOG89MbIMRLbQLHY82bprZmI1qXkwFsHqU7AjDVlJ84onFhj_f0ix0agta20sl6vT4A__dHRIV04u-L3HkF3htt3qLNmZPGrhE0rAnae3sgQLdJpOaJi4fsT_7qBqcT_Hjs1Nif6ixqQJUYm-1ha5a0A5CE5Snc7yD0pe3jCXEK6Bq7jiam8UjUztfahmBY5V57W6g-TgyVuL1VeUfeeufaMbYtUGvYrFVv0z-eN7EUbDG1w4gDt32mahw5Kz1zqY4ZpT4ddNhg9A6_5EteLpVQ3afgmi5g861hAjI6pj4R0FKu9ILrj7URDcuTtXiKI_7JiKW2LozrRk6tIWbZNQ65nFQOqK_yz-AHWWCxwASeBA1kKgSN41xS_SlJgdegt-wsVxmKlr-04tnNlJ6ekeRJdP3TrXI-TIHXvqGG1VvlBpTG3121DN0HakqXX160Xn0rb-TcVXF6vH2ux7Dif1PSwoJa1AIUZuM6iVeRcLMBDpegVtNykzju4xB8lz0RpSL8ERaCciEB3DHLQPWohvz3kZPLoPmISY17sGyY0zT6b7Kkqj9jFV2YBIIOeUgs30Y7BX-xForAixajtgz3vdAxp9OT84o51j3uhArQoCBxFARACxysRcCQ3hTr4jzXK0oiRvqbE5DftYqSf2xXNyiu7AdytnTnO9YwY3GGiHEuACjd93I7Mdb76MeMiGG_W2HpmwyJeXKDsLTzm8Jk9AByv6esoMlfOADFM3LB0srpgopzOsFFkVf4R7-LqbVSX6POuLbnmcBIfdTYwfXNxTcgy3YTzfAOhnAjx6XJ7uVMpQ_bRigX5HsIjNbiJsxKyy1Y6fby3ii3r3e6uvlCPbPK4HtYX3bEnYkdgqBnTZ6To1VmlZ3hGGJnkTTOBYip0p0eGpfAsPcqTdNE9t6fHRivIiLA85oPYIu_CXIyLTIK0UIcndPZKv8_v99rw-Titjmx0qKsT4kZUa5fA7ml4vPmQXwRU_4EVMbbxiBQ2T9AvRF0rQ8SxpeC8CnhCrGu7UOBDpJY9jtrJOU5njO9o_nzieDakaH8tHqmM3EyYQKQOtH0l2Sb9Bbx5VfJBWxr2Y9EkDnTfN9pEMZNWiVLTA9bDJwDNIy_8GinBlxM-bd9AE5TgxciULxY8keREdTrLEwnOtpvd6CosfRX4Q=","id":"rs_0325baf3a8da6f37016a9ad2fd768c87d2995132f877a52228","status":null,"summary":[],"type":"reasoning"},{"content":[{"annotations":[],"logprobs":[],"text":"{\"predicted_label\":\"CLS-OJNSG\",\"abstain\":false,\"used_insight_ids\":[],\"reasoning_summary\":\"Il profilo combina dispersione massima su XMEAS-1, superamenti persistenti di residual su XMEAS-20 e di diff con co-occorrenza residual/diff su XMEAS-10. Questo è più coerente con gli esempi CLS-OJNSG rispetto alle firme centrate su XMEAS-1 positivo persistente, XMEAS-18 o XMEAS-7.\"}","type":"output_text"}],"id":"msg_0325baf3a8da6f37016a9ad2ffb22c87d2bb4b9e34da54fa1f","phase":"final_answer","role":"assistant","status":"completed","type":"message"}],"parallel_tool_calls":true,"presence_penalty":0.0,"previous_response_id":null,"prompt":null,"prompt_cache_key":null,"prompt_cache_options":null,"prompt_cache_retention":"24h","reasoning":{"context":"all_turns","effort":"medium","generate_summary":null,"mode":"standard","summary":null},"safety_identifier":null,"service_tier":"default","status":"completed","store":false,"temperature":1.0,"text":{"format":{"description":null,"name":"phase_b_diagnostic_output","schema_":{"additionalProperties":false,"properties":{"abstain":{"type":"boolean"},"predicted_label":{"type":["string","null"]},"reasoning_summary":{"minLength":1,"type":"string"},"used_insight_ids":{"items":{"type":"string"},"type":"array"}},"required":["predicted_label","abstain","used_insight_ids","reasoning_summary"],"title":"Phase B diagnostic output (OpenAI Structured Outputs)","type":"object"},"strict":true,"type":"json_schema"},"verbosity":"medium"},"tool_choice":"auto","tool_usage":{"image_gen":{"input_tokens":0,"input_tokens_details":{"image_tokens":0,"text_tokens":0},"output_tokens":0,"output_tokens_details":{"image_tokens":0,"text_tokens":0},"total_tokens":0},"web_search":{"num_requests":0}},"tools":[],"top_logprobs":0,"top_p":0.98,"truncation":"disabled","usage":{"compute_units":null,"input_tokens":2338,"input_tokens_details":{"cache_write_tokens":2335,"cached_tokens":0},"output_tokens":294,"output_tokens_details":{"reasoning_tokens":165},"total_tokens":2632},"user":null},"returned_model":"gpt-5.6-terra","sdk_version":"3.6.0","total_tokens":2632,"usage_raw":{"compute_units":null,"input_tokens":2338,"input_tokens_details":{"cache_write_tokens":2335,"cached_tokens":0},"output_tokens":294,"output_tokens_details":{"reasoning_tokens":165},"total_tokens":2632}},"sequence_index":442,"timestamp":"2026-09-04T14:17:39.609787+00:00"}
