{"attempt":1,"base_prompt_hash":"892ba341a66e0d06d4202d90c8f515003bb44c801ebc3484a4e2a8a6b29bd56a","input_hash":"8ade865771c09317ca53350c58630c3e61531cb3aed048fb17c5af186a746c0b","job_key":"EXP3V2-F13-003|agent_4|B|2","prompt_hash":"892ba341a66e0d06d4202d90c8f515003bb44c801ebc3484a4e2a8a6b29bd56a","record_type":"request_intent","request_parameters":{"max_output_tokens":512,"previous_response_id_used":false,"reasoning_effort":"medium","seed_sent":false,"store":false,"temperature_sent":false},"requested_model":"gpt-5.6-terra","response":null,"sequence_index":966,"timestamp":"2026-09-04T14:52:43.413743+00:00"}
