{"attempt":1,"base_prompt_hash":"d45f9178569da61d835bd3bca4d88da16c276f2aadc64f3aa3a38450736fa3b0","input_hash":"d7a75fcf58b2caaa1dfcdabacb98c30f788e9a9b8bbddd5186f10fe8733324f4","job_key":"EXP3V2-F13-002|agent_3|B|3","prompt_hash":"d45f9178569da61d835bd3bca4d88da16c276f2aadc64f3aa3a38450736fa3b0","record_type":"request_intent","request_parameters":{"max_output_tokens":512,"previous_response_id_used":false,"reasoning_effort":"medium","seed_sent":false,"store":false,"temperature_sent":false},"requested_model":"gpt-5.6-terra","response":null,"sequence_index":926,"timestamp":"2026-09-04T14:50:05.410638+00:00"}
