{"attempt":1,"base_prompt_hash":"9ddad7f99e60f27fbfaaa7949ab3da0d29575a124e82da2d867260193782ef90","input_hash":"216f2325672e2e7276af4dd8a91e699b3b86f8f8da9cff70155d5c88bbd5bc77","job_key":"EXP3V2-F1-002|agent_1|E|2","prompt_hash":"9ddad7f99e60f27fbfaaa7949ab3da0d29575a124e82da2d867260193782ef90","record_type":"request_intent","request_parameters":{"max_output_tokens":512,"previous_response_id_used":false,"reasoning_effort":"medium","seed_sent":false,"store":false,"temperature_sent":false},"requested_model":"gpt-5.6-terra","response":null,"sequence_index":256,"timestamp":"2026-09-04T14:07:16.434562+00:00"}
