{"attempt":1,"base_prompt_hash":"cac78a8ea103cd6761f34f755b6b9c703f42b470f9390047ae0c8e945c91651f","input_hash":"72f87789fbdc41f6b1e807367fd8cce5dcf1dcca10b46a5ec62cec0cb5b8a899","job_key":"EXP3V2-F8-004|agent_3|E|2","prompt_hash":"cac78a8ea103cd6761f34f755b6b9c703f42b470f9390047ae0c8e945c91651f","record_type":"provider_response","request_parameters":{"max_output_tokens":512,"previous_response_id_used":false,"reasoning_effort":"medium","seed_sent":false,"store":false,"temperature_sent":false},"requested_model":"gpt-5.6-terra","response":{"api_family":"Responses API","endpoint":"/v1/responses","input_tokens":2340,"output_tokens":194,"raw_output":"{\"predicted_label\":\"CLS-Z3ISU\",\"abstain\":false,\"used_insight_ids\":[\"INS-003\",\"INS-004\"],\"reasoning_summary\":\"Il caso presenta superamenti di spostamento e pendenza in 7–8 finestre, con run di segno brevi, e variabilità residua in 8/8 finestre. Le frequenze di diff e di superamento congiunto residual/diff pari a 5/8 corrispondono al pattern CLS-Z3ISU.\"}","request_id":"req_e613ffbd504742cdb6ebbf88fb5152a6","requested_model":"gpt-5.6-terra","response_id":"resp_03d7b9262f86bf4a016a9ad53bb73087d29cabbdf9f302a6a6","response_raw":{"background":false,"billing":{"payer":"developer"},"completed_at":1788532030.0,"conversation":null,"created_at":1788532027.0,"error":null,"frequency_penalty":0.0,"id":"resp_03d7b9262f86bf4a016a9ad53bb73087d29cabbdf9f302a6a6","incomplete_details":null,"instructions":null,"max_output_tokens":512,"max_tool_calls":null,"metadata":{},"model":"gpt-5.6-terra","moderation":null,"object":"response","output":[{"content":[],"encrypted_content":"gAAAAABqmtU-p18q8ootnBFfp2o9_STszMgnaFJM_5NmM3IvZo-_rrV80kPeI0-WlfapR_dRoIuPLiGHmce0swR90u0-4aENWqcdD_2ecKYClZFygcdJudqRgX6hX1RuZu4_QVlOlV9QGr6izJDOeiALL4OFn0LpZI-fMCH0uq6bO2p7NfgT338ss9EgmwdGfutUUOwb4WetR2x3vuBeaA34eo8cjVPvC3luFGGTvshC_3RN6N6sVBiAlbXVjaVZIXyEUOl0puMlET5DXkG_lPgtWudEMvXUV4hjy-Ia9xPe-SZthsz199-C-sYJxE-8O6y3osqdOJ4B5SAPQEUs7jxIEA_ZlUuS-VesNZZ1aRxOwiDISLCYZ0Q2XyxC9s5kZAeoCgJPUaDRKMgbhG0hDlBw5b4CRmPvAlmXzim5cXQdVWWDoHrMhYttqNzX5jKE381Sh-ZEqvG5GSi53UHcrT4vsGv-p1wrlJ2TobAVGXvs-RK2YX2T5qtZDv_4a7FL4-4tIFvV6hxfYh20PRoSAoQfVbz777DBdJs0Sf70pNSfTM8j-qb1C99P5muojh4Vd1eVzO3LZ1maTtUiIloySfQ43aiYGAJxmL7i6TL_Zqmr96kSONVu7P1J6h9C-Lt1msa0Y8RqL81I2KjGKuBZ8vIf3mrpdmUxQ0bRiWjv3b3s50n1ouvlHNWlRFiksOFkZxWAOh8NyKTHl7gKGqRJNZ772p7kmN7tYGHgW7lb9dI3rumYiHcxqYzs37uFr0-Y1qMfegIZP-vGM9f-wRFWZjM2xJgLLmSwg8W1hFP39Y4Dx1_co1u6TSlVxsxxUokAyP8WScKmiv4U-J_RcAiqYGdUVmJpa40l8QaPUkYDE1DzXzUweRblqVTGkk2CZdaa42ldEC9g_Y-irj7PffnR9bn5wTziA4zadENk_N-RY3Ln2qlOk8uRS99aNQBzFNnlN-bFk0koFjrJffEZnhUrAo-IZxzWzrfWRUF7gn90sDC54UQcC_mkVMxpXyZK4DDVzL_TUQZnp27RO_BqRMfLMTVOzDEV1nDxzs1J2R3aiX1fgFviTu6JqOK_RnnIKkfBttQLtUvNHuLzYIob0wtGw9-INSvt7Nv8lsEYTtI_DMxBwjkafqjhMYkSR4ADIDrE8ENkxriWYLZXBQkUIifWiBM_fDat_zmiVOOKVf12G_tqg1_jg8UpdlOQdr-VQ4X15ZJNgkgE4JSDWYdyyz8o0hVStXAeOzPMhyHQEsReaFstuZFAFBFMt2c7eYqD47pxdE1Sse7Ov7qRFzJ3h1nBYiZgdyYLxg7mIsaBxGTwz0aH2xsigU20KdVIGUOMcjl4uWpYduf596TT7UFn0-09D4bVrvDpltDgckuuftJxXc73JRjJWp81B27ELY99LKJrwqPPxC2IzxAeGBvxm8qdkjAH0pcpZRIiS8ID9eczfArkCHxOkgA36JkyrH2UMBYcJWS96Tyno4MRN_LzuECdkwPB5xWFomSoRA==","id":"rs_03d7b9262f86bf4a016a9ad53c3fb887d298b2ed62e4729ead","status":null,"summary":[],"type":"reasoning"},{"content":[{"annotations":[],"logprobs":[],"text":"{\"predicted_label\":\"CLS-Z3ISU\",\"abstain\":false,\"used_insight_ids\":[\"INS-003\",\"INS-004\"],\"reasoning_summary\":\"Il caso presenta superamenti di spostamento e pendenza in 7–8 finestre, con run di segno brevi, e variabilità residua in 8/8 finestre. Le frequenze di diff e di superamento congiunto residual/diff pari a 5/8 corrispondono al pattern CLS-Z3ISU.\"}","type":"output_text"}],"id":"msg_03d7b9262f86bf4a016a9ad53d4a5487d28d2058d9ac22a93a","phase":"final_answer","role":"assistant","status":"completed","type":"message"}],"parallel_tool_calls":true,"presence_penalty":0.0,"previous_response_id":null,"prompt":null,"prompt_cache_key":null,"prompt_cache_options":null,"prompt_cache_retention":"24h","reasoning":{"context":"all_turns","effort":"medium","generate_summary":null,"mode":"standard","summary":null},"safety_identifier":null,"service_tier":"default","status":"completed","store":false,"temperature":1.0,"text":{"format":{"description":null,"name":"phase_b_diagnostic_output","schema_":{"additionalProperties":false,"properties":{"abstain":{"type":"boolean"},"predicted_label":{"type":["string","null"]},"reasoning_summary":{"minLength":1,"type":"string"},"used_insight_ids":{"items":{"type":"string"},"type":"array"}},"required":["predicted_label","abstain","used_insight_ids","reasoning_summary"],"title":"Phase B diagnostic output (OpenAI Structured Outputs)","type":"object"},"strict":true,"type":"json_schema"},"verbosity":"medium"},"tool_choice":"auto","tool_usage":{"image_gen":{"input_tokens":0,"input_tokens_details":{"image_tokens":0,"text_tokens":0},"output_tokens":0,"output_tokens_details":{"image_tokens":0,"text_tokens":0},"total_tokens":0},"web_search":{"num_requests":0}},"tools":[],"top_logprobs":0,"top_p":0.98,"truncation":"disabled","usage":{"compute_units":null,"input_tokens":2340,"input_tokens_details":{"cache_write_tokens":0,"cached_tokens":2337},"output_tokens":194,"output_tokens_details":{"reasoning_tokens":71},"total_tokens":2534},"user":null},"returned_model":"gpt-5.6-terra","sdk_version":"3.6.0","total_tokens":2534,"usage_raw":{"compute_units":null,"input_tokens":2340,"input_tokens_details":{"cache_write_tokens":0,"cached_tokens":2337},"output_tokens":194,"output_tokens_details":{"reasoning_tokens":71},"total_tokens":2534}},"sequence_index":562,"timestamp":"2026-09-04T14:27:11.063225+00:00"}
