{"attempt":1,"base_prompt_hash":"07e27f3123356f8d029cb5c775a0eb1adca33869fa69e1779df89ee4cc82b1a1","input_hash":"6cd2716414a6bfa61680cde75144f8a81bf2676a362751dd105d784ba4d28828","job_key":"EXP3V2-F1-003|agent_2|B|1","prompt_hash":"07e27f3123356f8d029cb5c775a0eb1adca33869fa69e1779df89ee4cc82b1a1","record_type":"request_intent","request_parameters":{"max_output_tokens":512,"previous_response_id_used":false,"reasoning_effort":"medium","seed_sent":false,"store":false,"temperature_sent":false},"requested_model":"gpt-5.6-terra","response":null,"sequence_index":298,"timestamp":"2026-09-04T14:09:29.353863+00:00"}
