{"attempt":1,"base_prompt_hash":"e33722fc05d4a0a993c5a598a67d532b0f77c474eb6929854efff23ec32fb19d","input_hash":"30e486633ec3d52fd900ccc66b7005ec7c54ce0d582548badbc365895daf3db1","job_key":"EXP3V2-F8-006|agent_3|E|2","prompt_hash":"e33722fc05d4a0a993c5a598a67d532b0f77c474eb6929854efff23ec32fb19d","record_type":"provider_response","request_parameters":{"max_output_tokens":512,"previous_response_id_used":false,"reasoning_effort":"medium","seed_sent":false,"store":false,"temperature_sent":false},"requested_model":"gpt-5.6-terra","response":{"api_family":"Responses API","endpoint":"/v1/responses","input_tokens":2340,"output_tokens":349,"raw_output":"{\"predicted_label\":\"CLS-Z3ISU\",\"abstain\":false,\"used_insight_ids\":[\"INS-003\",\"INS-004\"],\"reasoning_summary\":\"Il caso mostra superamenti di spostamento e pendenza in 8/8 finestre, variabilità residua in 8/8 e variazioni campione-campione con superamento congiunto in 5/8. Questo corrisponde al profilo osservato per CLS-Z3ISU.\"}","request_id":"req_378205aa3aef4cd086dab57e283bc1dc","requested_model":"gpt-5.6-terra","response_id":"resp_013fee4b1acdf941016a9ad699b95c87d29a61c6fc4fe3e07c","response_raw":{"background":false,"billing":{"payer":"developer"},"completed_at":1788532384.0,"conversation":null,"created_at":1788532377.0,"error":null,"frequency_penalty":0.0,"id":"resp_013fee4b1acdf941016a9ad699b95c87d29a61c6fc4fe3e07c","incomplete_details":null,"instructions":null,"max_output_tokens":512,"max_tool_calls":null,"metadata":{},"model":"gpt-5.6-terra","moderation":null,"object":"response","output":[{"content":[],"encrypted_content":"gAAAAABqmtagcfV9rcM7roYMKtLAsL3YHNPUj0Ro66Sje6JEP2YihRQsYknfkODhX4Q8GmVi7TQf0GOtjoG5mJFqIUjXaygJLXpBaOMrRRbI201_mtc7foq343Z2QgoAD84tu_vPJ7pNqZNtK7ZaG-_TFzmuFukFfimcviav0_nq61RiSvSitdy7y7C5WpCC9R2BrPYAP-Vka4-0zPtKoVjnAiYNmopvqyTuAM6aDWglFgtq7hK-X2k1z7LyWbKdOrj_gcTDDMsx5OPc1qjm7VzNUHoTZfAQnYYwg9WjzOloByUMke5y9X76sZwh9kz2ebTCJ9V0R0DDEfSb14dX_LyeFO10EaSZE06JPSMBmG1GWL9knOzvAca05e3_Juc9GoJG_cFxEA1dSiRHkT8ZWZpx9zGYIzi1uZncMqFnwbsqkbfRqsV_LdsGLlTVSMtdUzAUi_l4DcawTENVaVeoPzJ-ErA9Sgy23PyEZUvxsz5CfuRVub5CBNkgrSKgTSEtjZW-JaP7SHoSZ4O31RwKFXln3fBrDkPbBcqSYfNlkQzdQKwZl-qTZ2IrV9klo3pR-9DWSkcPZZM0nC84W_licQ0cLi5FS-kZk5PEJA0SQ0BUaAnEVcjjyVR16Gy0N1oGr0yVmis6As8HtdK8CtEZGgEMGjbnvQTd4mjzT8EIYuNWVEsYs1GNHFtvaGjpekJ34R4VAFU2GgEFaJS15MNdki4JeIvWqrmSggl6FRGXuH77ykInYpPdNoYiWn0GIHhWb2slX4XWrETqC27ZbxRda_LzcvaavHCsjMMy6yEgM-v5JvYQ491rZHXNgHCD7tAua7-acMF_pt0m7qzo0WFziEKdlovOh2l7kRe76y7hAWDJkyPhFrYRXNp6MMIwmFfZK-6aW7KGk1UXeB1u8iaJfnvhjppv25hZmOA4Z3pZkhjUzUePQ7HHgtf8ERisiOB1s9I8idyAAgrVg5S-ub2bgKZILwGHYdUQ7ZxWdWSURG6fU04MVuW9DOl8xCHc2uJ6CNCAmLqF2n9tvz4r2oocCL6bR6RlpHUHfjGlUF_AQgmYQQ9j1yQ8hproI2RfOpsWKh7-F1JciPmpLqJfmNIr2g1EPsRN61wbZfpHA-Oe6C_tn3bx6T_mj9f5I9yPhkAgghNC9Qb6JU1itB0n2iQ0MgS-3NlUpumWdM0JMnD3uUQsaRNuqvKoD-M6fB_c8aSCQZNZYFTMN3i5kAuSz40vK5PrmPkg1NpCc08EtWVq4E9hzB1gQ-ARUJzfcuza4lrRSscP4PFvN44yEQoZZ_ivhl6T33aIvAsJ6GmnY9o8t_MCPKOyHjTPrqTFw9k12EfLepheO04T4t_hrMT0zfYF7ywaflYWyGlLBZS1ZlY_yhxQ6SwW-luM_UvXuAPIAByWda7NUCDYeP1Fc2_-RPZqdR-X5QJpED0k9ukbqwsPYE6RuUmLaL8evFUhjKzNMNJ4XsftU3ls82xKw_dvDgIMASAzNjGNFTnBICU2ZfVU7svSUilNaXlOKS07JAfUsWmCdU-em49oDuyDFL_6cZyO4fQwpESQ1-V7Y5PYCrzhbVXoHpu2F5A1CzvbwbK1zdGhMZREpS5NmqM5toYoLHjuqM37XAOmmbsRPX_XZFPdIbLfItOe1NUpWAVtJTU1xD-8j2nmyUUfBCcruKA8uA81-EzKpd-U2EOj9hRknNiQP1KE4syciCMPwBnfNmBsgEiWrC-S-atNMxdPwJL4lFz0U256itH1v7Ykyu2Idg4TSsTy43MROjbA_TYgDYmTjPSVXEE3AkQ2mSNOx4Jl5UavglCFcGwwW_FsIo5JY2Fse5LjyCTVb3XWqnR9NfoiwrjG8_2FciUbX4prQFIRM85t8L0boWF2bcYYBw6hWd-jFGgmC594B0UDY71qsgrKFz7HWQ3XxXyww8aINCDa5Qttlpdit_C4W88OmS0yLX-zF_AKyBXH63m_HoYijS06Y-6V5tDanlqnfABs7OINPWoeTLxW7kdG9-npocuTt8bsrN9eyygFLEs_WyYigH8pfP3XvWun5Ph3rG15vbWjGnnCLSU_RJ2DF6oXw6FaK_9AGUdELPQjI3umqSdjuY3iR0dl_ZnZNy953oJ12_bBbIlVt2W5zp76FjbmbjyEm_qpipC5Acl3Kq9BgDaLA_Q_u-wf4w_u0Et5sRwweuvGSYrcCRxQJh6cY27mybULOoHwAo-1PyIPj5BQvTOH_Tj3lAOqTs-nwayVRLfgsa2EguFlY0odmJNSdJ_dPgicTiU7UFRtjo9t7ykicNFslOXyZAgkY2U8VQ-oCMIhjIUVN9erCN3KlQjEV42k8vxq3uqvurHg8fd8RB-UfQDbh-m4H9bx0qdggwGoo_1U","id":"rs_013fee4b1acdf941016a9ad69ac80c87d2a47f570d3427f62b","status":null,"summary":[],"type":"reasoning"},{"content":[{"annotations":[],"logprobs":[],"text":"{\"predicted_label\":\"CLS-Z3ISU\",\"abstain\":false,\"used_insight_ids\":[\"INS-003\",\"INS-004\"],\"reasoning_summary\":\"Il caso mostra superamenti di spostamento e pendenza in 8/8 finestre, variabilità residua in 8/8 e variazioni campione-campione con superamento congiunto in 5/8. Questo corrisponde al profilo osservato per CLS-Z3ISU.\"}","type":"output_text"}],"id":"msg_013fee4b1acdf941016a9ad69f1f0087d285290c24938afeb9","phase":"final_answer","role":"assistant","status":"completed","type":"message"}],"parallel_tool_calls":true,"presence_penalty":0.0,"previous_response_id":null,"prompt":null,"prompt_cache_key":null,"prompt_cache_options":null,"prompt_cache_retention":"24h","reasoning":{"context":"all_turns","effort":"medium","generate_summary":null,"mode":"standard","summary":null},"safety_identifier":null,"service_tier":"default","status":"completed","store":false,"temperature":1.0,"text":{"format":{"description":null,"name":"phase_b_diagnostic_output","schema_":{"additionalProperties":false,"properties":{"abstain":{"type":"boolean"},"predicted_label":{"type":["string","null"]},"reasoning_summary":{"minLength":1,"type":"string"},"used_insight_ids":{"items":{"type":"string"},"type":"array"}},"required":["predicted_label","abstain","used_insight_ids","reasoning_summary"],"title":"Phase B diagnostic output (OpenAI Structured Outputs)","type":"object"},"strict":true,"type":"json_schema"},"verbosity":"medium"},"tool_choice":"auto","tool_usage":{"image_gen":{"input_tokens":0,"input_tokens_details":{"image_tokens":0,"text_tokens":0},"output_tokens":0,"output_tokens_details":{"image_tokens":0,"text_tokens":0},"total_tokens":0},"web_search":{"num_requests":0}},"tools":[],"top_logprobs":0,"top_p":0.98,"truncation":"disabled","usage":{"compute_units":null,"input_tokens":2340,"input_tokens_details":{"cache_write_tokens":0,"cached_tokens":2337},"output_tokens":349,"output_tokens_details":{"reasoning_tokens":235},"total_tokens":2689},"user":null},"returned_model":"gpt-5.6-terra","sdk_version":"3.6.0","total_tokens":2689,"usage_raw":{"compute_units":null,"input_tokens":2340,"input_tokens_details":{"cache_write_tokens":0,"cached_tokens":2337},"output_tokens":349,"output_tokens_details":{"reasoning_tokens":235},"total_tokens":2689}},"sequence_index":634,"timestamp":"2026-09-04T14:33:04.247695+00:00"}
