{"attempt":1,"base_prompt_hash":"f8c78a2db05571de742ead717193a229708598d97659750d7acffda0527d973f","input_hash":"6b6c61257aed90fb1050c06d9d596dc127e4a11eeae0b12c9956fc7e377e2e3d","job_key":"EXP3V2-F10-003|agent_1|A|3","prompt_hash":"f8c78a2db05571de742ead717193a229708598d97659750d7acffda0527d973f","record_type":"request_intent","request_parameters":{"max_output_tokens":512,"previous_response_id_used":false,"reasoning_effort":"medium","seed_sent":false,"store":false,"temperature_sent":false},"requested_model":"gpt-5.6-terra","response":null,"sequence_index":727,"timestamp":"2026-09-04T14:37:57.144334+00:00"}
