{"attempt":1,"base_prompt_hash":"8cfdce852ab7874608a8aeb699bae19ff6dc62c4043b139bb985b71ef092eabf","input_hash":"8ade865771c09317ca53350c58630c3e61531cb3aed048fb17c5af186a746c0b","job_key":"EXP3V2-F13-003|agent_1|A|3","prompt_hash":"8cfdce852ab7874608a8aeb699bae19ff6dc62c4043b139bb985b71ef092eabf","record_type":"provider_response","request_parameters":{"max_output_tokens":512,"previous_response_id_used":false,"reasoning_effort":"medium","seed_sent":false,"store":false,"temperature_sent":false},"requested_model":"gpt-5.6-terra","response":{"api_family":"Responses API","endpoint":"/v1/responses","input_tokens":1645,"output_tokens":135,"raw_output":"{\"predicted_label\":null,\"abstain\":true,\"used_insight_ids\":[],\"reasoning_summary\":\"Il caso mostra anomalie persistenti e multivariate non corrispondenti al profilo CLS-ZOGAA né ai profili Normal forniti. Non sono disponibili esempi etichettati per associare con affidabilità questo pattern agli altri label.\"}","request_id":"req_7d61e399b7c84efa9add7c2dc364be8c","requested_model":"gpt-5.6-terra","response_id":"resp_05c1b5b4eae45ce0016a9adadc7b0087d2a6d7e600d4ad67d1","response_raw":{"background":false,"billing":{"payer":"developer"},"completed_at":1788533471.0,"conversation":null,"created_at":1788533468.0,"error":null,"frequency_penalty":0.0,"id":"resp_05c1b5b4eae45ce0016a9adadc7b0087d2a6d7e600d4ad67d1","incomplete_details":null,"instructions":null,"max_output_tokens":512,"max_tool_calls":null,"metadata":{},"model":"gpt-5.6-terra","moderation":null,"object":"response","output":[{"content":[],"encrypted_content":"gAAAAABqmtrfPu6-hGQVMW-dN_wBoUnEyMV_Pxf99YbGPJWXH8tZaalfP6eRW0qFTiY4GYKMq4wYDWIqeWOg_RMtHCYi6VuRUFpJXyFUxc40s0RXYGsjNJ81v3hWE2sBS5iFsKsi1oYjpP4J4atZgD_R1vsaegDVEyffJ3gLPW9ex0_lN-FN4oQzHc5klMve8WgND1PKt0WYghaGvCozqIsHg3jEzT36hGZZmIIfMF2GTFGTKfqbZ50xD8hPb9G8g-wImsQLt6D88D19THngmHFUFIDtErTzt_Z_GC56swDFwfug44gUGK_D0JdntItx1noTgUN68w-Bn6Dw5RNCyUC5htZJQnRlyIFJm_psVxlZ6z2UsQgVoIkqkbfS0wW9NQKP_2CAZPzlNjfV2jZddaNnz1b1nB50hZm0FnZKoT1tPe7dIbrkTZoldpW1iSfnuTw_Ogjfjf4MwDe2O4taz8itpHRXqjWpI__tD7hNxIiLiC81saZuHQerFvLXQ-wSXLOK9pduLaYzsrpSv7Hs_pBT-1MEwdCR2iW6TmPtS2X3xaJpUJtkQXebWC61jnbc5YrVcpsyQRx53MYDVCKep2fAtFfwwsOcj3Ke1vXz931iM2gZ8x_jZCqdY4eRQk29Ww2hQbGE6k_-xg9UX60b1RmOKCKyrqWBPQh3PLAY5b3gMbdqHXVmDhhchn1DQomqUBat0y6MPWMEGtJ-iTXjqTEc--YLpzZf7YUzt7dm2LwRp4fHQVi2R0sXZ9vK06GDlK-5Dexol8sb3-H4jJkYo7pPTf-FcRInCj5sU04Za0U_5QW5OetGgTtAgYPfVaY1JUHI3AAfjgTZB7wq8eQ4qUrvezke_utUlwD5UkiEpw-eyE_Pg2NLzuQDtHOM7KZdxHUAVxuLrgTKCV9MTLE1k2hPY21tO98pbklqvVzSABZYo0vCtmexOTXEUizcPXtOteTuZLPn3IkPn8rWdg4B-6oPiNm9Vh9OrEtPvnSU1rHI7iBteAaBVbuAkjI_DXXbZ4y2-m4BVxCaMLt22wxpyGgMlkTOivppQJyfoLOU0YobfDxEgmhwiEJIJDK6u5dQYsIDx3Aw9iT6wmX-WNaoJjYugmkkrIr0jmyeQoPCQhhJGq39SlDzY8KTzJGbBHvDq6ONv6JT-oR_v5toQHHFFpPxOFFgGXHAXWPypm165h_ybn7Pt8CYOLG0t1L7KFus_FZQ9GaPSfdsSyf7VrAsOaYuK5RP1qbtWI9hRT7jWsVCm8GPfgRHoS3AJaFQnEusUxRH7W6hnr8ZPJFWIWbKCSEH7WBYV7bvRn10w3imbh9yxUpRZdnkVUmezqnkBKtMQNahVXJ20t074zetJ3YeLovgG_nxFyMRwASpEVTDkadyH60FhXHjfXRbv-qi-lSB_v4Ufy8KGpPK6ivQ09cOhkDa6AsWax-DIhV5QmQO1wFaethT_P3Xd9kcpWg2Z22oktYdXkU-KDqo","id":"rs_05c1b5b4eae45ce0016a9adadd18c487d2a05b3e93d1402869","status":null,"summary":[],"type":"reasoning"},{"content":[{"annotations":[],"logprobs":[],"text":"{\"predicted_label\":null,\"abstain\":true,\"used_insight_ids\":[],\"reasoning_summary\":\"Il caso mostra anomalie persistenti e multivariate non corrispondenti al profilo CLS-ZOGAA né ai profili Normal forniti. Non sono disponibili esempi etichettati per associare con affidabilità questo pattern agli altri label.\"}","type":"output_text"}],"id":"msg_05c1b5b4eae45ce0016a9adade3a8487d2a456ab257da97156","phase":"final_answer","role":"assistant","status":"completed","type":"message"}],"parallel_tool_calls":true,"presence_penalty":0.0,"previous_response_id":null,"prompt":null,"prompt_cache_key":null,"prompt_cache_options":null,"prompt_cache_retention":"24h","reasoning":{"context":"all_turns","effort":"medium","generate_summary":null,"mode":"standard","summary":null},"safety_identifier":null,"service_tier":"default","status":"completed","store":false,"temperature":1.0,"text":{"format":{"description":null,"name":"phase_b_diagnostic_output","schema_":{"additionalProperties":false,"properties":{"abstain":{"type":"boolean"},"predicted_label":{"type":["string","null"]},"reasoning_summary":{"minLength":1,"type":"string"},"used_insight_ids":{"items":{"type":"string"},"type":"array"}},"required":["predicted_label","abstain","used_insight_ids","reasoning_summary"],"title":"Phase B diagnostic output (OpenAI Structured Outputs)","type":"object"},"strict":true,"type":"json_schema"},"verbosity":"medium"},"tool_choice":"auto","tool_usage":{"image_gen":{"input_tokens":0,"input_tokens_details":{"image_tokens":0,"text_tokens":0},"output_tokens":0,"output_tokens_details":{"image_tokens":0,"text_tokens":0},"total_tokens":0},"web_search":{"num_requests":0}},"tools":[],"top_logprobs":0,"top_p":0.98,"truncation":"disabled","usage":{"compute_units":null,"input_tokens":1645,"input_tokens_details":{"cache_write_tokens":0,"cached_tokens":1642},"output_tokens":135,"output_tokens_details":{"reasoning_tokens":47},"total_tokens":1780},"user":null},"returned_model":"gpt-5.6-terra","sdk_version":"3.6.0","total_tokens":1780,"usage_raw":{"compute_units":null,"input_tokens":1645,"input_tokens_details":{"cache_write_tokens":0,"cached_tokens":1642},"output_tokens":135,"output_tokens_details":{"reasoning_tokens":47},"total_tokens":1780}},"sequence_index":943,"timestamp":"2026-09-04T14:51:11.889058+00:00"}
