{"attempt":1,"base_prompt_hash":"9c51ba3d42b0a29ce390a765d045999b287680fb168ebef276401e721f5e3e9f","input_hash":"e0439c1a7eefc7b2fc85407e69fa874fbfc74b0d55d200957679da544161fdec","job_key":"EXP3V2-N-004|agent_4|E|3","prompt_hash":"9c51ba3d42b0a29ce390a765d045999b287680fb168ebef276401e721f5e3e9f","record_type":"request_intent","request_parameters":{"max_output_tokens":512,"previous_response_id_used":false,"reasoning_effort":"medium","seed_sent":false,"store":false,"temperature_sent":false},"requested_model":"gpt-5.6-terra","response":null,"sequence_index":141,"timestamp":"2026-09-04T14:02:09.014736+00:00"}
