{"attempt":1,"base_prompt_hash":"30b8cce016146b1cc1574b2274c3b692a13a7ae440a3457413a1c29abeba43ee","input_hash":"30e486633ec3d52fd900ccc66b7005ec7c54ce0d582548badbc365895daf3db1","job_key":"EXP3V2-F8-006|agent_3|A|3","prompt_hash":"30b8cce016146b1cc1574b2274c3b692a13a7ae440a3457413a1c29abeba43ee","record_type":"provider_response","request_parameters":{"max_output_tokens":512,"previous_response_id_used":false,"reasoning_effort":"medium","seed_sent":false,"store":false,"temperature_sent":false},"requested_model":"gpt-5.6-terra","response":{"api_family":"Responses API","endpoint":"/v1/responses","input_tokens":1659,"output_tokens":261,"raw_output":"{\"predicted_label\":\"CLS-R463B\",\"abstain\":false,\"used_insight_ids\":[],\"reasoning_summary\":\"Il caso mostra superamenti persistenti e diffusi delle soglie di spostamento, pendenza, variabilità residua e variazioni campione-campione, con dispersione molto elevata. Questo profilo è più coerente con gli esempi anomali CLS-R463B che con i casi Normal.\"}","request_id":"req_24fddeccfbb34828ac24446d2d65d758","requested_model":"gpt-5.6-terra","response_id":"resp_06381d8272c187c9016a9ad6a8f00c87d2a5ae2a0d9a3e256b","response_raw":{"background":false,"billing":{"payer":"developer"},"completed_at":1788532397.0,"conversation":null,"created_at":1788532392.0,"error":null,"frequency_penalty":0.0,"id":"resp_06381d8272c187c9016a9ad6a8f00c87d2a5ae2a0d9a3e256b","incomplete_details":null,"instructions":null,"max_output_tokens":512,"max_tool_calls":null,"metadata":{},"model":"gpt-5.6-terra","moderation":null,"object":"response","output":[{"content":[],"encrypted_content":"gAAAAABqmtataJ8cIsYzcjpLSnMwVA4VTEyY3tdeX6PJfF6WVXUJ4bobJNPoeFGfPZFS9ojmGaBsfv6SqzXmiV10TlCv8d3rnndJbY9WVanAKxRSRGtFsZaA__zRnJqlk82C5Zxys5262N5QHPsO0MT749xfZeQBG9i_EMSRIlkJTgZpU-JIyNg3y9baKYRdJGe69UO2gtXBqh4yy9hcg_Zw-b1IkfG3hSBQ2QSj9W9QE0bjmhKEW7UzuOda7DcnGNIzAD3UKCDMA14TAuCiKYp8fsZe9iIA5mi_S0huUjXDLYeAZL8q5_bFgIozcXtjj-0wHPnNiF6BbVVEDQBtMvJLlvAQM_5ZXEM9o0Al1mQJml9a6GAhQWub7a36KR20djflwuXyZHuJKTV8pjn-42OlhctGta60JbcYC7L7uKrV4mdHAnbSYaJPFRmcultPAmffPC3fqd1T2fRf4ypMg-pDb6DIc4-IBrOjAm0F-hCibPXXStrUytlIfT_y45_TAXTyEOQk-4oNTRnuVt3aMTtvBJNPxLsALy4URYpaNZhRDPg2z5BKRnAmEvzxrcnsdVYP5Mkhqarj-sL8rJZdyJiQwKNW-2AzelV4T0U6ZA8Y0DU73c3EjMuU4jBvtcomF0R_tGF7USd7ekmeXP5k5ZWeqTzr3_0C5K8D88nPeYQJ_g2AnJg5piLrITV8sgs9j2KJa-oQHUkN9e2-jSVXHDmxdVIGMcnGc-O_lI7Nt0iuz9CwP3CdXlAkkQhi5-_5PHJ-0S-td27PBTfQWjNELKs8Fx1oss3FiM5IcDRHjJ1WOF_JtXalpB6_w_wIZAdgtshkpG48CBwdXtSneqeHAcRng1O9Egl-DDs2FVumjXfiSaKDlrqGO7qaddS00wtONyjBlqWMrNrxAL978QEzQw-8Yv714qt2ctZ65-8at3s7EiURyXV70_yTyqBEsjzpx6SqC794AFzRAryvIC-g-cfBSTH4AVQr5L4tyLsmXhnBuVx6kVxKQSHrgfwdj5tD9o2EnuC43JUIDfBUnEi51zJeFvTAtCcqstx3Bml9SCQ4HEnkJEtbtT13-vPpKcP3KOSoUV3AY0Uu0g_dChiwe6AP0ZMuJDyyriO-qPkTHVtyOwUXNoRDewTsijyEaueRcukERgWY-3-nuo6UvT5dXFgEmsi0AI59NKDBsPts9LCFJGsQ2j8RaAq1ubiKm813EYC_16jKx979HsV-u9WTK84FJZL7vGfiJAqlWYDvsWpxVsXZnTNRaSgik0zjliGO4Jf0047d-wsZJpU7IDg3PSFLPOnBTmwDV9Qsasny-LXpEPkE5DPnmkutE5hFsoRmbZu1ekV4mvUUCrPf4_Oh6Q2btuaTxGRz6Xw_Pm0XHGtG4l6314xTJMmLZ6df5Kh1bTQG7-vW0PYDZhxuh80cDAsVOk7JdLXraP5LkDvXukLHNDSm7Ldkiz7A8Xi5OwEo_kVaCSKIXOyisUaLSWH1VOtQT9gagMc8GqU0IGihZrvRLigfsgt1mFwV9cEUGI3WkWzujMy5jDkSQBbxaZ_OPENJ4VGKAay9gXvrzvbQXHHlCyIb5nIfCmE6N2oeXIK6B4oUqboBFUIQGlh-C1N1ZGmKTlnLGST82siT39GxAPJQ0dxrwhKe3tfV7p7Y9jvojUYwDZbnrFpRJXcjY6DIst47vtzZTuDogBCQbU-4EXcinvITLMsRllFbs85Kcvh96mZy6vDwZtFfDR-XMK78RipMLEE0EjJmIx6vSQUJTJ0V_CuhoMF8kp18uNmnDo9fFTU3dd4SmZa1AVzA958Rn-25pLrpuIEjyS5EdYnqUzFZhEQecNl8wLia4h-jQasFAi8QnzVlVyzhmgflksDt1pqF_GB92F_p1fUYmHTDZEATbuRkof_8kTeCCpG2RS_Q6Z-zrw_L-TJZX8bFNOEz9m2BSizQyZHaKL5eEzkcLD3by2MOQeInG9YidLZ1Z0fY6UAN7ENsLkzQ6on7A2q7JoCsDJROsFLAYfmItXl8RiznhTZ8Zwr5n2FMz3jYRrwTA6hsD0JU19Z-gTzQJn0dYhbqfA5cc5SOvuku6fGWorg1M1_XD5Gz1dafa2XjYVdlKBwjRJz94oB5mo4o-S6DSiHpKXsN--BSHOp2hk02e0cOs2sC6jPp1SinM_aoJeyfL2OqMP4c9fM0UB60mYpzpPN9Xx-5BO2MWA==","id":"rs_06381d8272c187c9016a9ad6a97bb487d2a681cb6276fb5ec8","status":null,"summary":[],"type":"reasoning"},{"content":[{"annotations":[],"logprobs":[],"text":"{\"predicted_label\":\"CLS-R463B\",\"abstain\":false,\"used_insight_ids\":[],\"reasoning_summary\":\"Il caso mostra superamenti persistenti e diffusi delle soglie di spostamento, pendenza, variabilità residua e variazioni campione-campione, con dispersione molto elevata. Questo profilo è più coerente con gli esempi anomali CLS-R463B che con i casi Normal.\"}","type":"output_text"}],"id":"msg_06381d8272c187c9016a9ad6ac491c87d2b408c716670ce30f","phase":"final_answer","role":"assistant","status":"completed","type":"message"}],"parallel_tool_calls":true,"presence_penalty":0.0,"previous_response_id":null,"prompt":null,"prompt_cache_key":null,"prompt_cache_options":null,"prompt_cache_retention":"24h","reasoning":{"context":"all_turns","effort":"medium","generate_summary":null,"mode":"standard","summary":null},"safety_identifier":null,"service_tier":"default","status":"completed","store":false,"temperature":1.0,"text":{"format":{"description":null,"name":"phase_b_diagnostic_output","schema_":{"additionalProperties":false,"properties":{"abstain":{"type":"boolean"},"predicted_label":{"type":["string","null"]},"reasoning_summary":{"minLength":1,"type":"string"},"used_insight_ids":{"items":{"type":"string"},"type":"array"}},"required":["predicted_label","abstain","used_insight_ids","reasoning_summary"],"title":"Phase B diagnostic output (OpenAI Structured Outputs)","type":"object"},"strict":true,"type":"json_schema"},"verbosity":"medium"},"tool_choice":"auto","tool_usage":{"image_gen":{"input_tokens":0,"input_tokens_details":{"image_tokens":0,"text_tokens":0},"output_tokens":0,"output_tokens_details":{"image_tokens":0,"text_tokens":0},"total_tokens":0},"web_search":{"num_requests":0}},"tools":[],"top_logprobs":0,"top_p":0.98,"truncation":"disabled","usage":{"compute_units":null,"input_tokens":1659,"input_tokens_details":{"cache_write_tokens":0,"cached_tokens":1656},"output_tokens":261,"output_tokens_details":{"reasoning_tokens":156},"total_tokens":1920},"user":null},"returned_model":"gpt-5.6-terra","sdk_version":"3.6.0","total_tokens":1920,"usage_raw":{"compute_units":null,"input_tokens":1659,"input_tokens_details":{"cache_write_tokens":0,"cached_tokens":1656},"output_tokens":261,"output_tokens_details":{"reasoning_tokens":156},"total_tokens":1920}},"sequence_index":637,"timestamp":"2026-09-04T14:33:17.694346+00:00"}
