{"attempt":1,"base_prompt_hash":"64df41e0796bbdb45567a315a171104cce0250445f8ac38fa3abca4f81c96d7e","input_hash":"1742ea0271c380f17e47c642b543c14978f8831e0707438cef741d39c8d1fa41","job_key":"EXP3V2-N-003|agent_1|A|3","prompt_hash":"64df41e0796bbdb45567a315a171104cce0250445f8ac38fa3abca4f81c96d7e","record_type":"request_intent","request_parameters":{"max_output_tokens":512,"previous_response_id_used":false,"reasoning_effort":"medium","seed_sent":false,"store":false,"temperature_sent":false},"requested_model":"gpt-5.6-terra","response":null,"sequence_index":79,"timestamp":"2026-09-04T13:59:20.631284+00:00"}
