{"attempt":1,"base_prompt_hash":"3dbf44de2e6b6d21bc22f62dcaedeaf71532e62c33d9a11e39b9c36492b744ba","input_hash":"b16b28815166abbcef183a39182726d089fc2947e527b1e3540e93f083262b05","job_key":"EXP3V2-F8-002|agent_1|A|1","prompt_hash":"3dbf44de2e6b6d21bc22f62dcaedeaf71532e62c33d9a11e39b9c36492b744ba","record_type":"request_intent","request_parameters":{"max_output_tokens":512,"previous_response_id_used":false,"reasoning_effort":"medium","seed_sent":false,"store":false,"temperature_sent":false},"requested_model":"gpt-5.6-terra","response":null,"sequence_index":468,"timestamp":"2026-09-04T14:19:52.126133+00:00"}
