{"attempt":1,"base_prompt_hash":"12a927c97900757431b09328850345d91ad7f79af24f2159bd6af4df20ee3581","input_hash":"6cd2716414a6bfa61680cde75144f8a81bf2676a362751dd105d784ba4d28828","job_key":"EXP3V2-F1-003|agent_1|B|2","prompt_hash":"12a927c97900757431b09328850345d91ad7f79af24f2159bd6af4df20ee3581","record_type":"request_intent","request_parameters":{"max_output_tokens":512,"previous_response_id_used":false,"reasoning_effort":"medium","seed_sent":false,"store":false,"temperature_sent":false},"requested_model":"gpt-5.6-terra","response":null,"sequence_index":291,"timestamp":"2026-09-04T14:09:05.781055+00:00"}
