{"attempt":1,"base_prompt_hash":"b2a085e1337ea30aeb0258d08f1a691fe05eb7cd68ec293b58d5a02ced15b648","input_hash":"562f63d712e38600e47d524b23aa04b7d3c85eed955e49dc2f7b92d0b1203daf","job_key":"EXP3V2-F13-005|agent_3|E|1","prompt_hash":"b2a085e1337ea30aeb0258d08f1a691fe05eb7cd68ec293b58d5a02ced15b648","record_type":"request_intent","request_parameters":{"max_output_tokens":512,"previous_response_id_used":false,"reasoning_effort":"medium","seed_sent":false,"store":false,"temperature_sent":false},"requested_model":"gpt-5.6-terra","response":null,"sequence_index":1028,"timestamp":"2026-09-04T14:56:52.254603+00:00"}
