{"attempt":1,"base_prompt_hash":"b5dd8f1c3094de862abef186a2142986ebe85161c0eae68cfc38528c9129e8ac","input_hash":"562f63d712e38600e47d524b23aa04b7d3c85eed955e49dc2f7b92d0b1203daf","job_key":"EXP3V2-F13-005|agent_3|A|2","prompt_hash":"b5dd8f1c3094de862abef186a2142986ebe85161c0eae68cfc38528c9129e8ac","record_type":"provider_response","request_parameters":{"max_output_tokens":512,"previous_response_id_used":false,"reasoning_effort":"medium","seed_sent":false,"store":false,"temperature_sent":false},"requested_model":"gpt-5.6-terra","response":{"api_family":"Responses API","endpoint":"/v1/responses","input_tokens":1659,"output_tokens":454,"raw_output":"{\"predicted_label\":\"CLS-R463B\",\"abstain\":false,\"used_insight_ids\":[],\"reasoning_summary\":\"Il caso mostra anomalie persistenti in tutte le finestre, incluse elevata variabilità residua e variazioni campione-campione simultanee, analogamente agli esempi CLS-R463B. L'ampia dispersione osservata supporta la stessa classe anomala.\"}","request_id":"req_b61215a6da2e41778a1dd53886f6eb11","requested_model":"gpt-5.6-terra","response_id":"resp_0cc80c75f091b352016a9adc402ef487d2a7c8d5c09532c1b1","response_raw":{"background":false,"billing":{"payer":"developer"},"completed_at":1788533832.0,"conversation":null,"created_at":1788533824.0,"error":null,"frequency_penalty":0.0,"id":"resp_0cc80c75f091b352016a9adc402ef487d2a7c8d5c09532c1b1","incomplete_details":null,"instructions":null,"max_output_tokens":512,"max_tool_calls":null,"metadata":{},"model":"gpt-5.6-terra","moderation":null,"object":"response","output":[{"content":[],"encrypted_content":"gAAAAABqmtxI3jwKg5lINjc4DxyUNAHWtjZb_WdcafyO4uRYEAOh3OD_GoAQP6Yxg3umqwU-A5O-tQSodi4coMixk1KaV1G8U3P6ecwwV5VaSpWYW4DHd4r_JlcepFs8bNZx_MQcsAFk0_EIlbE3VgmirqgYNS6BmM93riiPT46Cb_cQghvtIo_3lTCCcqmtAbWUN6cNELAvNalognhJrYG6elgJfMktaNtoPxOaQ_LhS_3Vil4HbLGg8Ktnnp8EVDuJSTVKOeJFysSV9xaGxTeBcWBnO13hC-7b9vhgpkeg6ffH5qcIuLd_qwOyWj6NSuvDex5oDOxNHFnNy4FMCaCEkqpMI2A7NHakjwf6cIheoq3sDIkCqo7CTkuuIQ9b8ky6tQpS6XwEtmAf7Zmq_U4Jm8hQvOgbb0dHIUcevYpbQ7d8kdHGcAu68ZM2bs29ft-hXDnAbRmkJtep18rJciUjkdbxJPyKNtWj_3mUPSlPjDnUs1yeMLDZA2FMLtuVD70Ib9ilxQu8ls8L-F6JYZ5C0YETvm4ubte5Kta9TKWVIoH_rvePQ-ct_MFn2QeGtZrNVmDOxx94-tVmR3m8RHoj89CF_IdOlvIMuspDpoDTUAKZK_ih_xyOef8GFxpPEYLRxaNvRcjmXmMHX_2FCj_3E0s3VAhSTz54W4Fgejvv1m7kvewJkr_AFRJDh9H9GkV7_pUY5-ZdcT5qTfy_Ffj3fKTx_M9fNWpBBVnhTnA0RK-tTQS7mUxeP9WS-1IgnJB1-EntERFwbQhuzc1y95aycNdixim3vyySOQnZbwUINhLq1pXIZCfSoYk6m6Ih2HD9o0Fs-aeIyL0Bt6f6hGdSNpJJbV4G51aCCeFuDGTP62nh8YOqjNPXBgNeXFY-2Zlvog6Mx4oJ5ksX3J4yRRKGHSE6-QpGTLBgAVAvfxXlb9vAFMFw2Z1EW7Opr25Aiet9ZuvzBpxYe9XZk75l3msdKqF8EapT0BJDlGEhuFWYHSNx1D5GIMvn1Zx4nJfWuE76tp2OfYvpu9AzMrYmv-evAC_4pKG8iZ0Oz7GL6ViST8zPAdpZbxQWwyK0NVobgYl3-Ys2F0e3VfOWf9cB8O5rAm7kzaPZFORxUQTXvJvRMzEU5LNgnETTuOhIOU_33T7O1GdJZFCfyScr6eHLQlRbK_6fJD0vKlsOPjqV0H6P2QR_itteN8KmxkUgthIPTaE1ScOM-mBVkZNQzNjIBWo83PpRUR1dW14mEj0z47Pn-jTq5XBluurNYfGGfGLyz9fI7ble8U8B1JDBfzayq8Q7ckHUo0tcaYLqxOS1tOdliquehvMgjXCfSOmpbav9hLsfASO67TPw51XcUHi2OluHu11OLgtK6_gG2BVLxUJzYWsbereRe4twyDu94Vp4Nf6sJXf_UMxnHHuqAuWjyAFZiNFEEqlnyWoJKZCbLGIYp-nJmBx85OkMJUpQks00B1nZdEwRIotft6zyHv7zEpMnAJ3K9nVagTrqj_-U9pWN2UK9LVPihLM2Lc0LmD2ipZ-L98ylwUAk6Fe4qTtnGHNmzLBFTbULcbIYRfuXSiwrXMNMy-voPejCb0gtiIMrs0Ftvpd9AWABtiwOc3GkQ5ZIKYLGxZLgmqm4n8ZI9JpMS0DgQQGxiR8595Fge5br8r-By2cBW5XNJNyjKL5-bWvkpLBQczzVLi2EYXdOfPUr6lIP3-N5ZaWXoNojmvQPwkuGoOl9fttgOaXiCuiThcR1W2MgR5ZqJST-67QIy4WErHljHPuwLKntvWagh99SK1VWiXU-_YaHRgkg6NUb8CTCJHxZhJ7RGTiS68RD5xdbmJDRTBrdxvz_0BqWs_iBwgzQcnnkbQ5A4cVNJVsHI2VRsAFHhMk9_iOU2tbCSGKpJTQohgseti5Jirrsp_wQdFyS1eK1IlqbupnkQM_qvq_ad7SwkgR3veUyjTCdzTsJ0DpBiz-XICbTo0fQabJuWE-E_Wm4ZihGb1EJC33ZhIWV17tTnM6bWB0WpbhpptDV53-_cOLhQerH5UYrPaOALwURST5ubz4QKxZZtnHtM08a0tkjRiZ8QpTvQT7BTszGq7EE0DQJrRIoxS2gGbSaQbrd8kPMAmOA3Y99uTlXbR3uREz1qa4VQFebCXa9z2DdJcJIFZERuEekgZH2zEl2S8XvIRzYUUh5bkfly9dy3TrRxlVKQf_G-Qpoi7QgXOsLPoGiKcxNfZt-YsT7c5sUzYCZowyWua90WWhS7d1T-kJMINfWDQfhDVZWvc3ywT57d4nkpBAss0qnN_pQ5r50JcdTLE9oY3oUPFDFAdVRRvxYJt31LpT7-FW8GVEPEc3nXo4mh3SlEM1-wAct_mx4-9u2tWb4fkH4zbPXoXsJe45TLVEf_EMwrWuFJDWKoyDqV-rH4iYLDuJSoll81VSfJWd_Gd_OxscjqoyETSgW05LTL9vFHQJdvuUV3TXlCDix3CDO6IGJs91fImLlUSQyVlh8c-ncV3Rkbp-luSR9QI-dUokzhGLysAx6baA9bX7xmULAZl6gFRVkEcTk7Fku8oJuH9a_xSVtBuuYp3Zr8FsGzOKtYfBRhvG0PU4SxQI0WJ8Mp0RBPc-W1RNQgDEIfuINPN0J3ztfCi74paDMf_9AIOUp2bpyaqrMMYODO7F1eVyTW8ZcUWNsX7fmCIzkwHoIGRE_um3VQc_yorE1TSopCIoAkAVIuc-MXa5gTC-1HMv5aP3IB-tqxlykDgXh8bj06XMhybSzZFiKhSfxQB-GQj87epmGV9aEcmhoIw0ReVVr_yITbXU_riCq0DwKAkXuqDpyrdR5wqkHhgh0sIcGdVXYrFDwOIidlJftc_ynxLOGGCvq_eSKf1NinYiI4jtfkd5Sz1T2hDHTHWV9Y_sqsC4lRl7RxX54Yb72XV6qNS9ARXlYU72-VKvc-sEpK-hyhwKr7w3lCi_HMiF9BRZFPII26GE6OEGY2uMpIjs1uFtplKw-JVCRK1XD5ImVLApu-EDmLQDYM7mmNdx7WLpiLxlHXzbtZRMyhO-o1DTCb-olWF6-oU9sFHH-Fl3JQL7usD8xawnsRrCtEdEZoza9k1lFwI3VjRatFwbHY96LzNOIL7tT3j-hSlAvu6ulYG-y9RJgbLYIxBB1f1oNSy45YQWRIw3jqutJy4A7fDjQnX6_vPGBKs3168OoxMYU4rBGmKn8EN8XHYbdvi1zRrkZibfx1pulWk4118U7oMycLXanxGWz6GycVx5_idzUcxKk6BFnIC9PJqpdFanGSs-9_g7nvlnShWPAp9n2JDiXB0mLkvr5iysMCOuKo841lsB4nPwer8OvXbccqF4HfjVDrG0895GWV1Z0hJZKZUDRMt7tbaNYYwfhUVCk4Quj2bQZmOchOB1M_rApH3zXWSyHGokVfNpdQpMsOozGiyI658SWT7wiUfMP4e0gcCvv8lLI3tT4afOWS9kyQjlHfRzgUcOko9gpmR48RUVIdt7OD7BN74lPLM9i804KYPAMJHCgNm5GNDXL0agEw0ddY20fb_cT6m6JnSJX0eQLM8g0etAmqUD_1ghBzfM8mdmEyahSfLbqqLXbftsjbc6LsDQvaFe_gufc0trab8mInxRV7imbstBfFvU=","id":"rs_0cc80c75f091b352016a9adc4104e887d2845bbe1d4172485f","status":null,"summary":[],"type":"reasoning"},{"content":[{"annotations":[],"logprobs":[],"text":"{\"predicted_label\":\"CLS-R463B\",\"abstain\":false,\"used_insight_ids\":[],\"reasoning_summary\":\"Il caso mostra anomalie persistenti in tutte le finestre, incluse elevata variabilità residua e variazioni campione-campione simultanee, analogamente agli esempi CLS-R463B. L'ampia dispersione osservata supporta la stessa classe anomala.\"}","type":"output_text"}],"id":"msg_0cc80c75f091b352016a9adc470a6487d2bfb5d9ce34f082fd","phase":"final_answer","role":"assistant","status":"completed","type":"message"}],"parallel_tool_calls":true,"presence_penalty":0.0,"previous_response_id":null,"prompt":null,"prompt_cache_key":null,"prompt_cache_options":null,"prompt_cache_retention":"24h","reasoning":{"context":"all_turns","effort":"medium","generate_summary":null,"mode":"standard","summary":null},"safety_identifier":null,"service_tier":"default","status":"completed","store":false,"temperature":1.0,"text":{"format":{"description":null,"name":"phase_b_diagnostic_output","schema_":{"additionalProperties":false,"properties":{"abstain":{"type":"boolean"},"predicted_label":{"type":["string","null"]},"reasoning_summary":{"minLength":1,"type":"string"},"used_insight_ids":{"items":{"type":"string"},"type":"array"}},"required":["predicted_label","abstain","used_insight_ids","reasoning_summary"],"title":"Phase B diagnostic output (OpenAI Structured Outputs)","type":"object"},"strict":true,"type":"json_schema"},"verbosity":"medium"},"tool_choice":"auto","tool_usage":{"image_gen":{"input_tokens":0,"input_tokens_details":{"image_tokens":0,"text_tokens":0},"output_tokens":0,"output_tokens_details":{"image_tokens":0,"text_tokens":0},"total_tokens":0},"web_search":{"num_requests":0}},"tools":[],"top_logprobs":0,"top_p":0.98,"truncation":"disabled","usage":{"compute_units":null,"input_tokens":1659,"input_tokens_details":{"cache_write_tokens":0,"cached_tokens":1656},"output_tokens":454,"output_tokens_details":{"reasoning_tokens":356},"total_tokens":2113},"user":null},"returned_model":"gpt-5.6-terra","sdk_version":"3.6.0","total_tokens":2113,"usage_raw":{"compute_units":null,"input_tokens":1659,"input_tokens_details":{"cache_write_tokens":0,"cached_tokens":1656},"output_tokens":454,"output_tokens_details":{"reasoning_tokens":356},"total_tokens":2113}},"sequence_index":1031,"timestamp":"2026-09-04T14:57:12.513612+00:00"}
