{"attempt":1,"base_prompt_hash":"483d8be18696df0449eca5981bc49567fcd474feef9259b303ffdf683012c137","input_hash":"216f2325672e2e7276af4dd8a91e699b3b86f8f8da9cff70155d5c88bbd5bc77","job_key":"EXP3V2-F1-002|agent_4|B|1","prompt_hash":"483d8be18696df0449eca5981bc49567fcd474feef9259b303ffdf683012c137","record_type":"provider_response","request_parameters":{"max_output_tokens":512,"previous_response_id_used":false,"reasoning_effort":"medium","seed_sent":false,"store":false,"temperature_sent":false},"requested_model":"gpt-5.6-terra","response":{"api_family":"Responses API","endpoint":"/v1/responses","input_tokens":2337,"output_tokens":97,"raw_output":"{\"predicted_label\":\"CLS-ZOGAA\",\"abstain\":false,\"used_insight_ids\":[\"INS-001\",\"INS-002\"],\"reasoning_summary\":\"The persistent positive 8/8 displacement of XMEAS-1 and its maximal dispersion closely match CLS-ZOGAA. The accompanying XMEAS-20 residual and sparse XMEAS-10 diff/joint exceedances also match the reported pattern.\"}","request_id":"req_8713392c2dd349d7b21d389c86491a18","requested_model":"gpt-5.6-terra","response_id":"resp_0243c68e4982f8f0016a9ad0d996e487d281082202eee14b19","response_raw":{"background":false,"billing":{"payer":"developer"},"completed_at":1788530914.0,"conversation":null,"created_at":1788530905.0,"error":null,"frequency_penalty":0.0,"id":"resp_0243c68e4982f8f0016a9ad0d996e487d281082202eee14b19","incomplete_details":null,"instructions":null,"max_output_tokens":512,"max_tool_calls":null,"metadata":{},"model":"gpt-5.6-terra","moderation":null,"object":"response","output":[{"content":[{"annotations":[],"logprobs":[],"text":"{\"predicted_label\":\"CLS-ZOGAA\",\"abstain\":false,\"used_insight_ids\":[\"INS-001\",\"INS-002\"],\"reasoning_summary\":\"The persistent positive 8/8 displacement of XMEAS-1 and its maximal dispersion closely match CLS-ZOGAA. The accompanying XMEAS-20 residual and sparse XMEAS-10 diff/joint exceedances also match the reported pattern.\"}","type":"output_text"}],"id":"msg_0243c68e4982f8f0016a9ad0da433087d2a6cd4a30e9722feb","phase":"final_answer","role":"assistant","status":"completed","type":"message"}],"parallel_tool_calls":true,"presence_penalty":0.0,"previous_response_id":null,"prompt":null,"prompt_cache_key":null,"prompt_cache_options":null,"prompt_cache_retention":"24h","reasoning":{"context":"all_turns","effort":"medium","generate_summary":null,"mode":"standard","summary":null},"safety_identifier":null,"service_tier":"default","status":"completed","store":false,"temperature":1.0,"text":{"format":{"description":null,"name":"phase_b_diagnostic_output","schema_":{"additionalProperties":false,"properties":{"abstain":{"type":"boolean"},"predicted_label":{"type":["string","null"]},"reasoning_summary":{"minLength":1,"type":"string"},"used_insight_ids":{"items":{"type":"string"},"type":"array"}},"required":["predicted_label","abstain","used_insight_ids","reasoning_summary"],"title":"Phase B diagnostic output (OpenAI Structured Outputs)","type":"object"},"strict":true,"type":"json_schema"},"verbosity":"medium"},"tool_choice":"auto","tool_usage":{"image_gen":{"input_tokens":0,"input_tokens_details":{"image_tokens":0,"text_tokens":0},"output_tokens":0,"output_tokens_details":{"image_tokens":0,"text_tokens":0},"total_tokens":0},"web_search":{"num_requests":0}},"tools":[],"top_logprobs":0,"top_p":0.98,"truncation":"disabled","usage":{"compute_units":null,"input_tokens":2337,"input_tokens_details":{"cache_write_tokens":2334,"cached_tokens":0},"output_tokens":97,"output_tokens_details":{"reasoning_tokens":0},"total_tokens":2434},"user":null},"returned_model":"gpt-5.6-terra","sdk_version":"3.6.0","total_tokens":2434,"usage_raw":{"compute_units":null,"input_tokens":2337,"input_tokens_details":{"cache_write_tokens":2334,"cached_tokens":0},"output_tokens":97,"output_tokens_details":{"reasoning_tokens":0},"total_tokens":2434}},"sequence_index":280,"timestamp":"2026-09-04T14:08:34.639156+00:00"}
