{"attempt":1,"base_prompt_hash":"2f73e6880f6be37d1ade52514a77959ec30b5c90bec8f4aef36b20ebd88b9e7b","input_hash":"e935ef02954bd2a5a50e9625c89190cdfda9d47b9ccbe00c4362d42a6b56d2df","job_key":"EXP3V2-F10-002|agent_4|B|1","prompt_hash":"2f73e6880f6be37d1ade52514a77959ec30b5c90bec8f4aef36b20ebd88b9e7b","record_type":"provider_response","request_parameters":{"max_output_tokens":512,"previous_response_id_used":false,"reasoning_effort":"medium","seed_sent":false,"store":false,"temperature_sent":false},"requested_model":"gpt-5.6-terra","response":{"api_family":"Responses API","endpoint":"/v1/responses","input_tokens":2344,"output_tokens":101,"raw_output":"{\"predicted_label\":\"CLS-R463B\",\"abstain\":false,\"used_insight_ids\":[\"INS-005\",\"INS-006\"],\"reasoning_summary\":\"Il caso coincide con il pattern CLS-R463B centrato su XMEAS-18: residual sopra soglia in 8/8 finestre, spostamento e pendenza persistenti, e concomitanza residual/diff in 7/8 finestre.\"}","request_id":"req_f663cc2c21d04335a14f4bc889cfa80a","requested_model":"gpt-5.6-terra","response_id":"resp_0854a9fda50c99bd016a9ad7996c2487d28d293f2a22937f67","response_raw":{"background":false,"billing":{"payer":"developer"},"completed_at":1788532636.0,"conversation":null,"created_at":1788532633.0,"error":null,"frequency_penalty":0.0,"id":"resp_0854a9fda50c99bd016a9ad7996c2487d28d293f2a22937f67","incomplete_details":null,"instructions":null,"max_output_tokens":512,"max_tool_calls":null,"metadata":{},"model":"gpt-5.6-terra","moderation":null,"object":"response","output":[{"content":[{"annotations":[],"logprobs":[],"text":"{\"predicted_label\":\"CLS-R463B\",\"abstain\":false,\"used_insight_ids\":[\"INS-005\",\"INS-006\"],\"reasoning_summary\":\"Il caso coincide con il pattern CLS-R463B centrato su XMEAS-18: residual sopra soglia in 8/8 finestre, spostamento e pendenza persistenti, e concomitanza residual/diff in 7/8 finestre.\"}","type":"output_text"}],"id":"msg_0854a9fda50c99bd016a9ad79a7eb487d283e0214871057d21","phase":"final_answer","role":"assistant","status":"completed","type":"message"}],"parallel_tool_calls":true,"presence_penalty":0.0,"previous_response_id":null,"prompt":null,"prompt_cache_key":null,"prompt_cache_options":null,"prompt_cache_retention":"24h","reasoning":{"context":"all_turns","effort":"medium","generate_summary":null,"mode":"standard","summary":null},"safety_identifier":null,"service_tier":"default","status":"completed","store":false,"temperature":1.0,"text":{"format":{"description":null,"name":"phase_b_diagnostic_output","schema_":{"additionalProperties":false,"properties":{"abstain":{"type":"boolean"},"predicted_label":{"type":["string","null"]},"reasoning_summary":{"minLength":1,"type":"string"},"used_insight_ids":{"items":{"type":"string"},"type":"array"}},"required":["predicted_label","abstain","used_insight_ids","reasoning_summary"],"title":"Phase B diagnostic output (OpenAI Structured Outputs)","type":"object"},"strict":true,"type":"json_schema"},"verbosity":"medium"},"tool_choice":"auto","tool_usage":{"image_gen":{"input_tokens":0,"input_tokens_details":{"image_tokens":0,"text_tokens":0},"output_tokens":0,"output_tokens_details":{"image_tokens":0,"text_tokens":0},"total_tokens":0},"web_search":{"num_requests":0}},"tools":[],"top_logprobs":0,"top_p":0.98,"truncation":"disabled","usage":{"compute_units":null,"input_tokens":2344,"input_tokens_details":{"cache_write_tokens":2341,"cached_tokens":0},"output_tokens":101,"output_tokens_details":{"reasoning_tokens":0},"total_tokens":2445},"user":null},"returned_model":"gpt-5.6-terra","sdk_version":"3.6.0","total_tokens":2445,"usage_raw":{"compute_units":null,"input_tokens":2344,"input_tokens_details":{"cache_write_tokens":2341,"cached_tokens":0},"output_tokens":101,"output_tokens_details":{"reasoning_tokens":0},"total_tokens":2445}},"sequence_index":712,"timestamp":"2026-09-04T14:37:16.379991+00:00"}
