{"attempt":1,"base_prompt_hash":"539971fcc33ff775a70a381b50bea095f557f84c500c4c8ce276420aaee9dbbc","input_hash":"e15feba8fb66cec3f4fa6898a2601bb5eb65f2196615d17f7a921f0cf59f0b21","job_key":"EXP3V2-N-005|agent_1|B|2","prompt_hash":"539971fcc33ff775a70a381b50bea095f557f84c500c4c8ce276420aaee9dbbc","record_type":"request_intent","request_parameters":{"max_output_tokens":512,"previous_response_id_used":false,"reasoning_effort":"medium","seed_sent":false,"store":false,"temperature_sent":false},"requested_model":"gpt-5.6-terra","response":null,"sequence_index":147,"timestamp":"2026-09-04T14:02:22.769383+00:00"}
